71.网络众包的开放式创新模式下用户创意质量研究,批准号：71702206,申请代码：G0112,项目类别：青年科学基金项目,项目负责人： 刘倩,资助经费：18.0（万元）,批准年度：2017,结题年度：2020,依托单位： 中央财经大学,关键词： 网络众包； 知识管理； 企业外部数据； 信息共享； 数据质量
72.金属衬底上高质量AlGaN的外延生长及组分可控机制研究,批准号：51702102,申请代码：E0207,项目类别：青年科学基金项目,项目负责人： 王文樑,资助经费：24.0（万元）,批准年度：2017,结题年度：2020,依托单位： 华南理工大学,关键词： 缺陷控制； 组分可控； 金属衬底； AlGaN； 界面反应
73.面向不同数据质量的多模态生理情感数据融合降维方法研究,批准号：61702370,申请代码：F06,项目类别：青年科学基金项目,项目负责人： 李超,资助经费：24.0（万元）,批准年度：2017,结题年度：2020,依托单位： 天津师范大学,关键词： 多模态生理信号融合； 情感数据噪声； 不充足样本； 情感识别； 情感数据缺失
74.基于GANs的复合因素降质图像高质量重建技术研究,批准号：61701011,申请代码：F0116,项目类别：青年科学基金项目,项目负责人： 李嘉锋,资助经费：26.5（万元）,批准年度：2017,结题年度：2020,依托单位： 北京工业大学,关键词： 图像恢复； 复合因素降质图像； 深度学习； 图像重建； 生成对抗网络
75.审计师工作压力与审计质量：基于个体感知视角的研究,批准号：71662021,申请代码：G0206,项目类别：地区科学基金项目,项目负责人： 闫焕民,资助经费：25.0（万元）,批准年度：2016,结题年度：2020,依托单位： 南昌大学,关键词： 审计师； 个体感知； 个体特征； 工作压力； 审计质量
76.互联网+环境下图书馆云服务质量的管理研究,批准号：71663009,申请代码：G0414,项目类别：地区科学基金项目,项目负责人： 黎春兰,资助经费：30.0（万元）,批准年度：2016,结题年度：2020,依托单位： 广西师范大学,关键词： 互联网+； 图书馆云； 服务质量； 云计算； 基于eTOM的管理视图
77.老年晚期癌症患者“优逝”模型的构建及死亡质量的实证研究,批准号：71704084,申请代码：G0405,项目类别：青年科学基金项目,项目负责人： 张玉玺,资助经费：18.0（万元）,批准年度：2017,结题年度：2020,依托单位： 南京医科大学,关键词： 老年患者； 死亡质量； 晚期癌症； 优逝
78.立面集成型垂直农场对室内环境质量影响研究,批准号：51708283,申请代码：E0801,项目类别：青年科学基金项目,项目负责人： 邵一鸣,资助经费：26.0（万元）,批准年度：2017,结题年度：2020,依托单位： 南京工业大学,关键词： 室内环境质量； 生态立面设计； 垂直农场； 效能评估； 计算机模拟分析
79.光致质量迁移效应构筑聚集诱导发光聚合物表面起伏图案,批准号：21674058,申请代码：B0503,项目类别：面上项目,项目负责人： 和亚宁,资助经费：68.0（万元）,批准年度：2016,结题年度：2020,依托单位： 清华大学,关键词： 光致质量迁移； 光响应； 偶氮； 聚集诱导发光； 荧光图案
80.新型滚球式碰撞调制质量阻尼器——装置构成及其减震性能研究,批准号：51678464,申请代码：E0806,项目类别：面上项目,项目负责人： 李书进,资助经费：60.0（万元）,批准年度：2016,结题年度：2020,依托单位： 武汉理工大学,关键词： 碰撞耗能； 平—扭耦合结构； 结构减震控制； 分布式质量阻尼； 滚球式调制质量阻尼器
81.温型连铸金属铸坯的质量和组织演变规律及机理,批准号：U1703131,申请代码：L09,项目类别：联合基金项目,项目负责人： 刘雪峰,资助经费：59.0（万元）,批准年度：2017,结题年度：2020,依托单位： 北京科技大学,关键词： 形成机理； 质量和组织； 演变规律； 温型连铸； 金属铸坯
82.自动后处理和语法错误校正驱动的译文质量提高方法,批准号：61662031,申请代码：F0211,项目类别：地区科学基金项目,项目负责人： 李茂西,资助经费：40.0（万元）,批准年度：2016,结题年度：2020,依托单位： 江西师范大学,关键词： 统计机器翻译； 神经网络机器翻译； 译文自动后编辑； 语法错误校正； 递归神经网络
83.光学高聚物超薄导光板连注连轧成型机理及质量控制,批准号：51675347,申请代码：E0508,项目类别：面上项目,项目负责人： 娄燕,资助经费：62.0（万元）,批准年度：2016,结题年度：2020,依托单位： 深圳大学,关键词： 超薄导光板； 成型机理； 微成型； 连注连轧； 高聚物
84.质量驱动的公共服务标准化研究：理论构建、机制设计与应用策略,批准号：71704112,申请代码：G0401,项目类别：青年科学基金项目,项目负责人： 耿旭,资助经费：19.0（万元）,批准年度：2017,结题年度：2020,依托单位： 深圳大学,关键词： 公共服务标准化； 服务质量； 应用策略； 理论构建； 机制设计
85.单面焊双面成形熔孔动态行为及背面成形质量智能控制,批准号：51675309,申请代码：E0508,项目类别：面上项目,项目负责人： 高进强,资助经费：62.0（万元）,批准年度：2016,结题年度：2020,依托单位： 山东大学,关键词： 熔孔； 形态参数； 智能化； 背面成形质量； 单面焊双面成形
86.基于低秩先验和对抗学习的低质量视频人脸表征学习研究,批准号：61702566,申请代码：F0210,项目类别：青年科学基金项目,项目负责人： 朱俊勇,资助经费：28.0（万元）,批准年度：2017,结题年度：2020,依托单位： 中山大学,关键词： 低秩； 特征提取； 低质量视频人脸； 表征学习； 对抗学习
87.基于统计分析的图像质量评价及应用技术研究,批准号：61703009,申请代码：F0304,项目类别：青年科学基金项目,项目负责人： 顾锞,资助经费：25.0（万元）,批准年度：2017,结题年度：2020,依托单位： 北京工业大学,关键词： 图像增强； 屏幕图像； 图像分析； 大数据； 质量评价
88.基于多目标优化分析的图书馆阅览空间照明质量研究,批准号：51678399,申请代码：E0803,项目类别：面上项目,项目负责人： 王立雄,资助经费：56.0（万元）,批准年度：2016,结题年度：2020,依托单位： 天津大学,关键词： 图书馆照明； 电子阅读媒体； 照明节能； 多目标优化分析； 主观评价
89. 医联体COPD患者药物治疗管理（MTM）服务模式构建及质量评价研究,批准号：71704075,申请代码：G0406,项目类别：青年科学基金项目,项目负责人： 吴秋惠,资助经费：18.0（万元）,批准年度：2017,结题年度：2020,依托单位： 南京大学,关键词： 药事管理； 药物经济； 临床药师； 临床药学； 合理用药
90.供应链质量管理中基于区块链的智能系统模型研究,批准号：71701091,申请代码：G0112,项目类别：青年科学基金项目,项目负责人： 颜嘉麒,资助经费：19.0（万元）,批准年度：2017,结题年度：2020,依托单位： 南京大学,关键词： 多智能体； 工作流； 供应链质量管理； 区块链； 本体
91.利用主梁质量和支座性能的连续梁桥调谐减震设计方法,批准号：51708466,申请代码：E0806,项目类别：青年科学基金项目,项目负责人： 邓开来,资助经费：24.0（万元）,批准年度：2017,结题年度：2020,依托单位： 西南交通大学,关键词： 优化设计； 连续梁桥； 抗震性能分析； 调谐质量减震； 组合隔震支座
92.基于数据驱动的热轧带钢产品质量在线诊断与优化方法,批准号：51704067,申请代码：E0414,项目类别：青年科学基金项目,项目负责人： 彭文,资助经费：23.0（万元）,批准年度：2017,结题年度：2020,依托单位： 东北大学,关键词： 热轧； 数据驱动； 质量诊断； 多目标优化
93.水合物分解对固井二界面胶结质量的影响机理,批准号：41702389,申请代码：D0209,项目类别：青年科学基金项目,项目负责人： 郑明明,资助经费：22.0（万元）,批准年度：2017,结题年度：2020,依托单位： 成都理工大学,关键词： 天然气水合物地层； 水化热； 二界面胶结质量； 固井； 水合物分解
94.CFRP制孔表面质量表征及其对连接强度性能影响机理研究,批准号：51705358,申请代码：E0509,项目类别：青年科学基金项目,项目负责人： 李皓,资助经费：25.0（万元）,批准年度：2017,结题年度：2020,依托单位： 天津大学,关键词： 碳纤维增强复合材料； 连接失效； 复合材料切削机理； 表面完整性； 表面质量表征
95.复杂电能质量环境下的电力弹簧多目标协调控制研究及应用,批准号：51707013,申请代码：E0704,项目类别：青年科学基金项目,项目负责人： 罗潇,资助经费：25.0（万元）,批准年度：2017,结题年度：2020,依托单位： 长沙理工大学,关键词： 电能质量； 智能负载； 电力弹簧； 协调优化控制； 新能源
96.基于PoF的开关电源全寿命周期质量波动建模及稳健设计研究,批准号：61671172,申请代码：F0118,项目类别：面上项目,项目负责人： 叶雪荣,资助经费：58.0（万元）,批准年度：2016,结题年度：2020,依托单位： 哈尔滨工业大学,关键词： 分散性； 开关电源； 不确定性； 稳健设计； 失效物理
97.高质量砷酸镓类晶体的生长及压电陀螺原型器件的制备,批准号：51672161,申请代码：E0201,项目类别：面上项目,项目负责人： 郭世义,资助经费：62.0（万元）,批准年度：2016,结题年度：2020,依托单位： 山东大学,关键词： 材料性能； 晶体结构； 器件制备； 晶体生长； 压电器件
98.基于通风与空气净化的住宅室内空气质量控制策略,批准号：51678395,申请代码：E0803,项目类别：面上项目,项目负责人： 陈清焰,资助经费：62.0（万元）,批准年度：2016,结题年度：2020,依托单位： 天津大学,关键词： 室内空气品质； 建筑环境测量； 通风策略； 计算流体力学； 空气净化
99.电磁继电器质量形成过程的不确定性建模及稳健设计,批准号：51707044,申请代码：E0705,项目类别：青年科学基金项目,项目负责人： 邓杰,资助经费：24.0（万元）,批准年度：2017,结题年度：2020,依托单位： 哈尔滨工业大学,关键词： 质量波动； 电磁继电器； 不确定性； 稳健设计
100.基于PVDF的高精密轴承滚动体冷墩成型质量在线检测机理研究,批准号：51705200,申请代码：E0511,项目类别：青年科学基金项目,项目负责人： 王桂从,资助经费：20.0（万元）,批准年度：2017,结题年度：2020,依托单位： 济南大学,关键词： 质量控制； 压电薄膜力传感器； 力反馈； 在线监测； 过程监控
101.珍珠蚌种质与所产无核珍珠质量及数量的相关性研究,批准号：31672654,申请代码：C1904,项目类别：面上项目,项目负责人： 李家乐,资助经费：65.0（万元）,批准年度：2016,结题年度：2020,依托单位： 上海海洋大学,关键词： 种质； 珍珠质量； 珍珠数量； 相关分析； 珍珠蚌
102.大质量黑洞潮汐瓦解恒星事件中的动力学和辐射性质,批准号：11673078,申请代码：A1503,项目类别：面上项目,项目负责人： 申荣锋,资助经费：66.0（万元）,批准年度：2016,结题年度：2020,依托单位： 中山大学,关键词： 相对论喷流； 暂现源； 吸积盘； X射线耀发； 潮汐瓦解事件
103.会计信息质量对企业技术创新的影响：机理、路径与价值效应,批准号：71672046,申请代码：G02,项目类别：面上项目,项目负责人： 王福胜,资助经费：46.0（万元）,批准年度：2016,结题年度：2020,依托单位： 哈尔滨工业大学,关键词： 影响机理； 会计信息质量； 技术创新； 价值效应； 传导路径
104.工程施工团队质量行为适应性机理、异化路径与防范机制研究,批准号：71671078,申请代码：G0115,项目类别：面上项目,项目负责人： 李真,资助经费：48.0（万元）,批准年度：2016,结题年度：2020,依托单位： 江苏大学,关键词： 防范机制； 情景模拟； 适应性机理； 工程项目管理； 质量行为
105.基于优化空间质量的城市中心区沿街建筑控制方法研究,批准号：51708274,申请代码：E0801,项目类别：青年科学基金项目,项目负责人： 唐莲,资助经费：25.0（万元）,批准年度：2017,结题年度：2020,依托单位： 南京大学,关键词： 街道空间； 设计导则； 沿街建筑； 街道界面； 城市设计
106.结构被动调谐质量阻尼器的非线性特性及其控制效果影响研究,批准号：51678116,申请代码：E0806,项目类别：面上项目,项目负责人： 李芦钰,资助经费：65.0（万元）,批准年度：2016,结题年度：2020,依托单位： 大连理工大学,关键词： 工程设计； 调谐质量阻尼器； 非线性； 试验研究； 被动控制
107.能量收集认知传感器网络中业务服务质量保障理论研究,批准号：61701241,申请代码：F0104,项目类别：青年科学基金项目,项目负责人： 焦万果,资助经费：21.5（万元）,批准年度：2017,结题年度：2020,依托单位： 南京林业大学,关键词： 无线传感器网络； 服务质量； 性能分析； 能量收集； 认知无线电
108.非经典测量误差模型及其在评估企业信息披露质量中的应用,批准号：71703078,申请代码：G0301,项目类别：青年科学基金项目,项目负责人： 洪圣杰,资助经费：17.0（万元）,批准年度：2017,结题年度：2020,依托单位： 清华大学,关键词： 信息披露造假； 企业研发； 非参数识别； 测量误差； 动态面板数据模型
109.近地面层大气细颗粒物的干物质质量浓度卫星遥感反演研究,批准号：41671367,申请代码：D0113,项目类别：面上项目,项目负责人： 李正强,资助经费：65.0（万元）,批准年度：2016,结题年度：2020,依托单位： 中国科学院空天信息创新研究院,关键词： 细颗粒物； PM2.5； 遥感； 反演； 卫星
110.审计契约压力传导对审计质量的影响及契约参与方应对策略研究,批准号：71672131,申请代码：G0206,项目类别：面上项目,项目负责人： 余玉苗,资助经费：47.0（万元）,批准年度：2016,结题年度：2020,依托单位： 武汉大学,关键词： 审计契约压力； 客户审计委员会； 审计项目团队； 签字注册会计师； 审计质量
111.复杂产品装配过程多态质量数据流建模及预测控制方法研究,批准号：71671130,申请代码：G0108,项目类别：面上项目,项目负责人： 庞继红,资助经费：49.3（万元）,批准年度：2016,结题年度：2020,依托单位： 温州大学,关键词： 质量工程； 持续改进； 监控方法； 质量改进； 复杂产品制造
112.地面气象观测资料时空相关性与同化前质量控制方法研究,批准号：41675156,申请代码：D0509,项目类别：面上项目,项目负责人： 叶小岭,资助经费：60.0（万元）,批准年度：2016,结题年度：2020,依托单位： 南京信息工程大学,关键词： 地面气象观测资料； 质量控制； 时空相关性； 分布特征； 极端天气
113.原子核质量及动力学形变对超重核合成机制的影响,批准号：11705055,申请代码：A2702,项目类别：青年科学基金项目,项目负责人： 包小军,资助经费：25.0（万元）,批准年度：2017,结题年度：2020,依托单位： 湖南师范大学,关键词： 动力学形变； 合成机制； 合成截面； 双核模型
"114.Z=50, N=82双幻数丰中子核区原子核质量的高精度测量",批准号：11675224,申请代码：A2701,项目类别：面上项目,项目负责人： 黄文学,资助经费：66.0（万元）,批准年度：2016,结题年度：2020,依托单位： 中国科学院近代物理研究所,关键词： 丰中子核； 原子核的质量； 原子核形变； r过程； 彭宁离子阱
115.基于GERT网络的多工序制造过程质量控制与维护策略联合建模研究,批准号：71701098,申请代码：G0108,项目类别：青年科学基金项目,项目负责人： 李亚平,资助经费：17.0（万元）,批准年度：2017,结题年度：2020,依托单位： 南京林业大学,关键词： 多工序制造过程； 维护策略； 统计过程控制； 半马尔可夫过程
116.三维激光扫描点云模型快速构建和质量评价关键技术研究,批准号：41674005,申请代码：D0401,项目类别：面上项目,项目负责人： 花向红,资助经费：70.0（万元）,批准年度：2016,结题年度：2020,依托单位： 武汉大学,关键词： 点云模型快速构建； 点云自动分类； 点云自适应简化； 三维激光扫描； 点云模型质量评价
117.基于多变量自然场景统计和局部均值估计的无参考立体图像质量评价,批准号：61662044,申请代码：F0210,项目类别：地区科学基金项目,项目负责人： 徐少平,资助经费：37.0（万元）,批准年度：2016,结题年度：2020,依托单位： 南昌大学,关键词： 多变量自然统计； 对比主观评价； 图像质量值映射； 图像质量评价； 图像质量感知特征
118.基于消费者网络评论的产品质量信息披露策略和定价研究,批准号：71671067,申请代码：G0102,项目类别：面上项目,项目负责人： 李田,资助经费：48.0（万元）,批准年度：2016,结题年度：2020,依托单位： 华东理工大学,关键词： 定价； 消费者网络评论； 信息披露； 信号博弈
119.成岩流体演化对致密砂岩气藏储层质量的控制作用研究,批准号：41702158,申请代码：D0207,项目类别：青年科学基金项目,项目负责人： 苏妮娜,资助经费：20.0（万元）,批准年度：2017,结题年度：2020,依托单位： 中国石油大学（华东）,关键词： 流体包裹体； 储层质量； 成岩流体演化； 成岩作用； 致密砂岩气藏
120.大数据环境下应急信息质量与信源可信度双路径作用机理研究,批准号：71663038,申请代码：G0414,项目类别：地区科学基金项目,项目负责人： 刘春年,资助经费：29.0（万元）,批准年度：2016,结题年度：2020,依托单位： 南昌大学,关键词： 双路径模型； 应急信息质量； 信源可信度； 信息资源； 信息行为
121.基于三维色谱指纹图谱的茶叶质量等级评定新方法研究,批准号：31701693,申请代码：C2008,项目类别：青年科学基金项目,项目负责人： 尹小丽,资助经费：25.0（万元）,批准年度：2017,结题年度：2020,依托单位： 长江大学,关键词： 化学计量学； 多元指纹图谱； 液相色谱； 质量等级评定； 茶叶
122.发酵饲料中生物胺对蜜蜂风险及蜂王浆质量的影响,批准号：31702194,申请代码：C1708,项目类别：青年科学基金项目,项目负责人： 赵柳微,资助经费：24.0（万元）,批准年度：2017,结题年度：2020,依托单位： 中国农业科学院蜜蜂研究所,关键词： 质量控制； 饲料； 生物胺； 蜂王浆； 蜜蜂
123.星系强引力透镜对宇宙学参数及早型星系质量密度轮廓的约束,批准号：11703034,申请代码：A1401,项目类别：青年科学基金项目,项目负责人： 陈云,资助经费：29.0（万元）,批准年度：2017,结题年度：2020,依托单位： 中国科学院国家天文台,关键词： 宇宙加速膨胀； 宇宙学模型参数
124.大面积高质量WS2薄膜的可控生长及光电性能研究,批准号：21701041,申请代码：B0502,项目类别：青年科学基金项目,项目负责人： 陈莹,资助经费：25.0（万元）,批准年度：2017,结题年度：2020,依托单位： 湖北工业大学,关键词： 纳米材料的制备； 化学气相沉积； 光电功能材料； 单分子自组装技术； 过渡金属硫族化合物
125.被动呼吸控制技术革新及患者实时在体质量控制平台建立的研究,批准号：11675042,申请代码：A3010,项目类别：面上项目,项目负责人： 胡伟刚,资助经费：58.0（万元）,批准年度：2016,结题年度：2020,依托单位： 复旦大学,关键词： 质量控制； 精准放疗； 被动呼吸控制； 放疗剂量验证
126.基于非参数层次贝叶斯景深估计模型的水下降质图像质量提升研究,批准号：61701245,申请代码：F0116,项目类别：青年科学基金项目,项目负责人： 庄培显,资助经费：20.0（万元）,批准年度：2017,结题年度：2020,依托单位： 南京信息工程大学,关键词： 图像去噪； 水下图像质量提升； 非参数贝叶斯； 图像融合框架； 统计颜色修正
127.数字图像相关反向算法的系统误差和散斑质量优化方法研究,批准号：11702287,申请代码：A0812,项目类别：青年科学基金项目,项目负责人： 苏勇,资助经费：25.0（万元）,批准年度：2017,结题年度：2020,依托单位： 中国科学技术大学,关键词： 反向算法； 散斑质量优化； 系统误差； 数字图像相关方法
128.联合多源数据研究长江源区冰川质量变化及其对水资源影响,批准号：41704011,申请代码：D0401,项目类别：青年科学基金项目,项目负责人： 超能芳,资助经费：25.0（万元）,批准年度：2017,结题年度：2020,依托单位： 华中科技大学,关键词： SWARM/GRACE； 水储量变化； CryoSat-2/ICESat； 长江流域； 冰川质量变化
129.快速城市化地区城市林业土壤质量特征及演变机制——以南京市为例,批准号：31670615,申请代码：C1606,项目类别：面上项目,项目负责人： 俞元春,资助经费：62.0（万元）,批准年度：2016,结题年度：2020,依托单位： 南京林业大学,关键词： 城市林业土壤； 土壤质量演变； 土壤肥力质量； 评价指标体系； 土壤环境质量
130.航空高温钛合金超声磁场辅助电火花线切割加工的微观表面质量研究,批准号：51705171,申请代码：E0509,项目类别：青年科学基金项目,项目负责人： 张臻,资助经费：25.0（万元）,批准年度：2017,结题年度：2020,依托单位： 华中科技大学,关键词： 电火花线切割； 超声振动； 磁场； 微观表面质量
131.区域下垫面性质变化对我国东部地区空气质量的影响,批准号：41671491,申请代码：D0711,项目类别：面上项目,项目负责人： 刘峻峰,资助经费：65.0（万元）,批准年度：2016,结题年度：2020,依托单位： 北京大学,关键词： 大气污染； 土地利用变化； 气候与化学耦合模型； 海表温度变化； 雾霾
132.基于低质量太阳系外行星搜寻的天文光梳定标精度研究,批准号：11703052,申请代码：A1904,项目类别：青年科学基金项目,项目负责人： 赵斐,资助经费：29.0（万元）,批准年度：2017,结题年度：2020,依托单位： 中国科学院国家天文台,关键词： 谱线分析； 类地行星； 波长定标； 视向速度观测； 天文光梳
133.优势卵泡比对HCG扳机时机的指导价值及影响卵子质量的机制研究,批准号：81671523,申请代码：H0420,项目类别：面上项目,项目负责人： 李轶,资助经费：57.0（万元）,批准年度：2016,结题年度：2020,依托单位： 中山大学,关键词： 体外受精-胚胎移植； 优势卵泡比； 卵子质量； 控制性超排卵； hCG注射时机
134.移动群智感知系统中基于数据质量保证的任务分配方法研究,批准号：61672148,申请代码：F0208,项目类别：面上项目,项目负责人： 于瑞云,资助经费：63.0（万元）,批准年度：2016,结题年度：2020,依托单位： 东北大学,关键词： 感知智能化； 群智计算； 群智感知； 数据质量管理
135.内质网质量控制系统决定膜蛋白新生肽链折叠或降解的机制,批准号：31670780,申请代码：C0505,项目类别：面上项目,项目负责人： 张在荣,资助经费：65.0（万元）,批准年度：2016,结题年度：2020,依托单位： 中国科学院上海有机化学研究所,关键词： 跨膜泛素连接酶； 错误折叠； 膜蛋白生物合成； 去泛素化酶； 内质网关联的降解
136.基于关键成分群构建“含量-基原-药效”关联的枸杞子质量评价体系研究,批准号：81703696,申请代码：H3204,项目类别：青年科学基金项目,项目负责人： 孙万阳,资助经费：20.0（万元）,批准年度：2017,结题年度：2020,依托单位： 暨南大学,关键词： 化学计量学； 质量控制方法； 含量-基原-药效关联； 枸杞子； 关键成分群
