137.大尺寸高质量二维锑烯可控制备及电输运性能研究,批准号：51702203,申请代码：E0207,项目类别：青年科学基金项目,项目负责人： 何学侠,资助经费：21.0（万元）,批准年度：2017,结题年度：2020,依托单位： 陕西师范大学,关键词： 锑烯； 化学气相沉积； 二维原子晶体材料； 电输运性质； 范德华外延
138.PAEs 暴露抑制线粒体呼吸链复合体酶活性致胚胎质量下降的机制研究,批准号：81701444,申请代码：H0414,项目类别：青年科学基金项目,项目负责人： 赵华,资助经费：20.0（万元）,批准年度：2017,结题年度：2020,依托单位： 郑州大学,关键词： 线粒体呼吸链； 胚胎线粒体； 邻苯二甲酸酯类； 线粒体拷贝数； 线粒体膜电位
139.碾压混凝土坝施工成层宏细观机理及层间结合质量实时控制研究,批准号：51679164,申请代码：E0906,项目类别：面上项目,项目负责人： 刘东海,资助经费：62.0（万元）,批准年度：2016,结题年度：2020,依托单位： 天津大学,关键词： 施工成层； 碾压混凝土坝； 实时控制； 层间结合质量； 宏细观机理
140.借壳动机，公司质量与投资者理性：基于中国借壳上市公司的研究,批准号：71702113,申请代码：G0205,项目类别：青年科学基金项目,项目负责人： 庞蔡吉,资助经费：18.0（万元）,批准年度：2017,结题年度：2020,依托单位： 首都经济贸易大学,关键词： 公司质量； 借壳上市； 投资者理性； 借壳动机
141.永久基本农田划定中耕地质量条件与耕地立地条件协同体系研究,批准号：41671329,申请代码：D0701,项目类别：面上项目,项目负责人： 钱凤魁,资助经费：70.0（万元）,批准年度：2016,结题年度：2020,依托单位： 沈阳农业大学,关键词： 耕地立地条件； 永久基本农田； 耕地质量； 协同体系； 协同关系
142.基于平面纳米线超临界掺杂效应和异质量子点嵌入结构的光电物性调控,批准号：61674075,申请代码：F0401,项目类别：面上项目,项目负责人： 余林蔚,资助经费：65.0（万元）,批准年度：2016,结题年度：2020,依托单位： 南京大学,关键词： 光电特性； 硅基纳米结构； 嵌入量子点； 平面纳米线； 巨掺杂效应
143.基于混沌理论的船用中速柴油机主轴承磨合质量在线定量评价方法,批准号：51705216,申请代码：E0505,项目类别：青年科学基金项目,项目负责人： 周元凯,资助经费：25.0（万元）,批准年度：2017,结题年度：2020,依托单位： 江苏科技大学,关键词： 磨合质量； 船用中速柴油机； 主轴承； 混沌理论； 定量评价
144.“村改居”老年人社区认同对生活质量的影响机制和干预研究,批准号：71704017,申请代码：G0401,项目类别：青年科学基金项目,项目负责人： 张金凤,资助经费：18.0（万元）,批准年度：2017,结题年度：2020,依托单位： 重庆大学,关键词： 老年人； 社区认同； 村改居； 生活质量
145.深冷处理-滚磨光整加工协同改善钛合金表面质量的机理研究,批准号：51705352,申请代码：E0509,项目类别：青年科学基金项目,项目负责人： 李永刚,资助经费：20.0（万元）,批准年度：2017,结题年度：2020,依托单位： 太原理工大学,关键词： 深冷处理； 表面质量； 表面粗糙度； 钛合金； 滚磨光整加工
146.镁合金低温熔盐扩散铝涂层的热力学缺陷统计研究及其质量评价方法,批准号：51704064,申请代码：E0412,项目类别：青年科学基金项目,项目负责人： 郭瑞,资助经费：25.0（万元）,批准年度：2017,结题年度：2020,依托单位： 东北大学,关键词： 比表面积； 密度泛函； 点缺陷； 铝镀层
147.基于大小数据结合的城市居家养老生活质量与邻里环境关系研究,批准号：41671154,申请代码：D0109,项目类别：面上项目,项目负责人： 卢佩莹,资助经费：59.0（万元）,批准年度：2016,结题年度：2020,依托单位： 香港大学深圳研究院,关键词： 居家养老； 智慧城市； 定性和定量分析； 生活质量； 空间分析模型
148.复合绝缘子内部缺陷的相控阵超声可视化检测与粘接质量评估方法研究,批准号：51677010,申请代码：E0702,项目类别：面上项目,项目负责人： 王平,资助经费：64.0（万元）,批准年度：2016,结题年度：2020,依托单位： 重庆大学,关键词： 超声检测； 特征提取； 复合绝缘子； 内部缺陷； 粘接质量
149.模块化级联多电平并网逆变系统功率平衡与电能质量协同控制理论研究,批准号：51677063,申请代码：E0706,项目类别：面上项目,项目负责人： 欧阳红林,资助经费：64.0（万元）,批准年度：2016,结题年度：2020,依托单位： 湖南大学,关键词： 协同控制； 功率平衡控制； 模块化级联多电平； 大型并网逆变系统； 等值电气模型
150.硬脆材料非球面超精密磨削表面质量不均匀性形成机理及控制研究,批准号：51705148,申请代码：E0509,项目类别：青年科学基金项目,项目负责人： 陈冰,资助经费：23.0（万元）,批准年度：2017,结题年度：2020,依托单位： 湖南科技大学,关键词： 超精密磨削； 非球面； 磨削痕迹； 表面质量均匀化； 磨削纹理
151.热中性环境下室内二氧化碳浓度对睡眠质量的影响研究,批准号：51708006,申请代码：E0803,项目类别：青年科学基金项目,项目负责人： 张晓静,资助经费：25.0（万元）,批准年度：2017,结题年度：2020,依托单位： 北京工业大学,关键词： 工作效率； 室内空气品质； 生理反应； 二氧化碳； 睡眠质量
152.激励磁场下等离子喷焊再制造熔覆成形机理及表面质量评定,批准号：51675155,申请代码：E0510,项目类别：面上项目,项目负责人： 黄海鸿,资助经费：70.0（万元）,批准年度：2016,结题年度：2020,依托单位： 合肥工业大学,关键词： 激励磁场； 绿色再制造； 质量评定； 等离子喷焊； 磁记忆检测
153.石油天然气开采对对流层臭氧和区域空气质量的影响研究,批准号：41675118,申请代码：D0506,项目类别：面上项目,项目负责人： 薛丽坤,资助经费：70.0（万元）,批准年度：2016,结题年度：2020,依托单位： 山东大学,关键词： 挥发性有机物； 对流层臭氧； 大气光化学； 油气开采； 区域空气污染
154.激波与单液滴相互作用及其对修正质量、动量和热量传递模型的影响,批准号：51676111,申请代码：E0605,项目类别：面上项目,项目负责人： 王兵,资助经费：67.0（万元）,批准年度：2016,结题年度：2020,依托单位： 清华大学,关键词： 热质传递； 液滴破碎； 激波； 动量传递； 相间作用
155.变分数据同化中的降阶方法及其在空气质量预报中的应用,批准号：11701273,申请代码：A0504,项目类别：青年科学基金项目,项目负责人： 徐勤武,资助经费：25.0（万元）,批准年度：2017,结题年度：2020,依托单位： 南京大学,关键词： 数据同化； 收敛性分析； 稳定性分析； 模型降阶； 数据降维
156.集成式铁路统一电能质量控制系统及其“站-网-车”交互作用研究,批准号：51707060,申请代码：E0706,项目类别：青年科学基金项目,项目负责人： 胡斯佳,资助经费：24.0（万元）,批准年度：2017,结题年度：2020,依托单位： 湖南大学,关键词： 变流器； 参数辨识； 电能质量； 数学建模； 电气化铁道电力系统
157.颗粒增强金属基复合材料磨削加工机理及高表面质量加工工艺理论研究,批准号：51705069,申请代码：E0509,项目类别：青年科学基金项目,项目负责人： 尹国强,资助经费：24.0（万元）,批准年度：2017,结题年度：2020,依托单位： 东北大学,关键词： 难加工材料； 表面质量； 磨削机理； 高速/超高速磨削； 磨削工艺
158.PP2A在低温携氧机械灌注改善边缘供肝质量中的作用及机制研究,批准号：81700574,申请代码：H0314,项目类别：青年科学基金项目,项目负责人： 熊艳,资助经费：18.0（万元）,批准年度：2017,结题年度：2020,依托单位： 武汉大学,关键词： 线粒体； 低温携氧机械灌注； 极限供肝； 蛋白磷酸酯酶2A
159.基于氢分子离子HD+振转光谱的精密测量确定质子电子质量比,批准号：91636216,申请代码：A2102,项目类别：重大研究计划,项目负责人： 童昕,资助经费：360.0（万元）,批准年度：2016,结题年度：2020,依托单位： 中国科学院精密测量科学与技术创新研究院,关键词： QED理论； 物理常数测量； 质子电子质量比； 氢分子离子HD+精密谱； 协同冷却
160.高质量近红外荧光金纳米簇的制备及其在生物成像中的应用研究,批准号：21705129,申请代码：B0403,项目类别：青年科学基金项目,项目负责人： 尚利,资助经费：25.0（万元）,批准年度：2017,结题年度：2020,依托单位： 西北工业大学,关键词： 荧光成像； 荧光探针； 近红外荧光探针； 金属纳米簇； 纳米生物作用
161.中国南方多云区域植被物候遥感探测方法研究：基于重建的高质量Landsat时间序列,批准号：41701378,申请代码：D0113,项目类别：青年科学基金项目,项目负责人： 朱孝林,资助经费：26.0（万元）,批准年度：2017,结题年度：2020,依托单位： 香港理工大学深圳研究院,关键词： 植被指数； 可见光-近红外遥感； 光合有效辐射； 物候期
162.基于“组-效-动”三元定向关联的黄芪“益气建中”功效的质量标志物研究,批准号：81703697,申请代码：H3204,项目类别：青年科学基金项目,项目负责人： 刘月涛,资助经费：20.0（万元）,批准年度：2017,结题年度：2020,依托单位： 山西大学,关键词： 黄芪； 组-效-动； 质量标志物； 代谢组学； 益气建中
163.实现碳减排和空气质量改善协同双控：引入需求侧行为的能源模型研究,批准号：71704187,申请代码：G0412,项目类别：青年科学基金项目,项目负责人： 杨曦,资助经费：18.0（万元）,批准年度：2017,结题年度：2020,依托单位： 中国石油大学（北京）,关键词： 能源需求； 温室气体减排； 能源系统优化； 节能减排； 可持续发展战略
164.采用单细胞RNA测序技术研究卵裂球表达谱与植入前胚胎质量评估的分子机理,批准号：81701451,申请代码：H0420,项目类别：青年科学基金项目,项目负责人： 李娜,资助经费：20.0（万元）,批准年度：2017,结题年度：2020,依托单位： 广州医科大学,关键词： 单细胞RNA测序； 早期发育； 胚胎质量评估； 基因群； 卵裂球
165.复杂不确定环境下基于FMEA的产品质量与可靠性管理方法研究,批准号：71671125,申请代码：G0108,项目类别：面上项目,项目负责人： 尤建新,资助经费：46.0（万元）,批准年度：2016,结题年度：2020,依托单位： 同济大学,关键词： 多准则决策方法； 故障模式及影响分析； 质量管理； 不确定理论
166.集成DOE的激光熔覆工艺及先进镍基高温合金熔覆质量控制机理研究,批准号：51675303,申请代码：E0509,项目类别：面上项目,项目负责人： 常保华,资助经费：62.0（万元）,批准年度：2016,结题年度：2020,依托单位： 清华大学,关键词： 定向凝固； 衍射光学元件； 热裂纹； 激光熔覆； 镍基高温合金
167.与主观感知一致的立体图像和视频视觉质量客观评价与增强研究,批准号：61672158,申请代码：F0210,项目类别：面上项目,项目负责人： 牛玉贞,资助经费：60.0（万元）,批准年度：2016,结题年度：2020,依托单位： 福州大学,关键词： 显著性分析与检测； 视差估计； 图像质量评价； 图像变形； 颜色校正
168.面向超表面制备的空间整形超快激光金属微纳结构大面积高质量加工,批准号：51675049,申请代码：E0509,项目类别：面上项目,项目负责人： 李晓炜,资助经费：62.0（万元）,批准年度：2016,结题年度：2020,依托单位： 北京理工大学,关键词： 金属微纳结构； 空间整形超快激光； 多尺度时间分辨观测； 超表面
169.基于反应过程中质量与热量变化差异的碳气化反应动力学基础研究,批准号：51704149,申请代码：E0410,项目类别：青年科学基金项目,项目负责人： 刘忠锁,资助经费：24.0（万元）,批准年度：2017,结题年度：2020,依托单位： 辽宁科技大学,关键词： 动力学； 质量变化； 热分析； 热量变化； 碳气化
170.面向全光集成的Si基大失配1.55μm波段InP量子点材料高质量外延生长,批准号：51672264,申请代码：E0207,项目类别：面上项目,项目负责人： 刘云,资助经费：62.0（万元）,批准年度：2016,结题年度：2020,依托单位： 中国科学院长春光学精密机械与物理研究所,关键词： 全光集成； 光互连； 穿线位错； 大失配； 量子点
171.解决方案的开发销售、风险管控、质量评估与价值创造研究：制造商与客户综合视角,批准号：71702122,申请代码：G0110,项目类别：青年科学基金项目,项目负责人： 冯永春,资助经费：18.0（万元）,批准年度：2017,结题年度：2020,依托单位： 天津财经大学,关键词： 解决方案； 制造商； 服务化； 战略转型
172.基于15N和13C代谢标记的蛋白质组学定性结果质量控制研究,批准号：31700727,申请代码：C2103,项目类别：青年科学基金项目,项目负责人： 刘超,资助经费：24.0（万元）,批准年度：2017,结题年度：2020,依托单位： 北京航空航天大学,关键词： 质量控制； 计算蛋白质组学； 肽段的质谱信号解析； 代谢标记； 假发现率
173.基于近零质量负载石墨烯电极的超高频AlScN声表面波谐振器研究,批准号：51705527,申请代码：E0512,项目类别：青年科学基金项目,项目负责人： 卓明,资助经费：24.0（万元）,批准年度：2017,结题年度：2020,依托单位： 中国人民解放军国防科技大学,关键词： 石墨烯； 声表面波器件； 超高频； 近零质量负载； 掺钪氮化铝
174.云制造环境下基于多元质量约束的机床装备动态服务网络构建及演化机理研究,批准号：51705049,申请代码：E0510,项目类别：青年科学基金项目,项目负责人： 李孝斌,资助经费：26.0（万元）,批准年度：2017,结题年度：2020,依托单位： 重庆大学,关键词： 云制造； 演化机理； 多元质量约束； 服务网络； 机床装备
175.面向超高清晰度的三维高动态范围视频系统视觉质量评价,批准号：61671258,申请代码：F0108,项目类别：面上项目,项目负责人： 郁梅,资助经费：60.0（万元）,批准年度：2016,结题年度：2020,依托单位： 宁波大学,关键词： 视觉质量评价； 编码失真； 立体视觉感知特性； 三维高动态范围视频系统； 色调映射失真
176.用户体验质量驱动的移动视频内容分发网络体系结构与关键技术研究,批准号：61671057,申请代码：F0104,项目类别：面上项目,项目负责人： 阳小龙,资助经费：58.0（万元）,批准年度：2016,结题年度：2020,依托单位： 北京科技大学,关键词： 视频自适应； 体系结构； 移动视频； 用户体验质量； 内容分发网络
177.大数据驱动下基于居民生活感知的参与式生活环境质量评价研究,批准号：51708414,申请代码：E0802,项目类别：青年科学基金项目,项目负责人： 骆晓,资助经费：21.0（万元）,批准年度：2017,结题年度：2020,依托单位： 同济大学,关键词： 宜居城市； 生活环境质量； 参与式规划； 大数据； 规划政策
178.骶棘韧带固定术与坐骨棘筋膜固定术的疗效及其对生活质量的影响比较,批准号：81601263,申请代码：H0409,项目类别：青年科学基金项目,项目负责人： 任常,资助经费：17.5（万元）,批准年度：2016,结题年度：2020,依托单位： 中国医学科学院北京协和医院,关键词： 转化医学； 盆底功能障碍疾病
179.大型地埋管群对地下温度场和地下水环境质量影响的研究,批准号：41702325,申请代码：D0705,项目类别：青年科学基金项目,项目负责人： 朱科,资助经费：22.0（万元）,批准年度：2017,结题年度：2020,依托单位： 山东建筑大学,关键词： 地下水； 地源热泵； 地下温度场； 地下环境； 地埋管
180.外部组织整合、知识获取对新服务开发绩效的影响：关系质量和吸收能力的调节作用,批准号：71672061,申请代码：G0110,项目类别：面上项目,项目负责人： 简兆权,资助经费：48.0（万元）,批准年度：2016,结题年度：2020,依托单位： 华南理工大学,关键词： 外部组织整合； 知识获取； 关系质量； 吸收能力； 新服务开发绩
181.基于小波分析的盾构隧道衬砌结构隐伏质量缺陷识别及其可视化关键技术研究,批准号：51678071,申请代码：E0806,项目类别：面上项目,项目负责人： 凌同华,资助经费：62.0（万元）,批准年度：2016,结题年度：2020,依托单位： 长沙理工大学,关键词： 盾构隧道； 衬砌结构； 三维图像可视化技术； 小波（报）分析； 无损检测技术
182.液相二次有机气溶胶生成机制及其对长三角空气质量影响研究,批准号：41705128,申请代码：D0502,项目类别：青年科学基金项目,项目负责人： 李楠,资助经费：25.0（万元）,批准年度：2017,结题年度：2020,依托单位： 南京信息工程大学,关键词： 来源解析； 空气质量； 数值模拟； 生成机制； 有机气溶胶
183.冷冻电镜研究RNA质量控制系统中相关生物大分子复合体的结构与功能,批准号：31530018,申请代码：C0507,项目类别：重点项目,项目负责人： 王宏伟,资助经费：270.0（万元）,批准年度：2015,结题年度：2020,依托单位： 清华大学,关键词： RNA加工； RNA降解酶； 冷冻电镜技术； RNA降解
184.低共熔溶剂中的质量-电荷传输特性分析及以其为电解液的液流电池性能改善研究,批准号：51676092,申请代码：E0603,项目类别：面上项目,项目负责人： 徐谦,资助经费：60.0（万元）,批准年度：2016,结题年度：2020,依托单位： 江苏大学,关键词： 传输特性； 储能液流电池； 低共熔溶剂； 性能强化
185.媒体报道下我国消费者农产品质量安全风险认知与购买行为形成机制研究,批准号：71703150,申请代码：G0311,项目类别：青年科学基金项目,项目负责人： 鄢贞,资助经费：19.0（万元）,批准年度：2017,结题年度：2020,依托单位： 浙江大学,关键词： 农业产业安全； 食物需求； 食物供应； 安全食品
186.田间环境对高速精播作业质量影响机理及排种器吸拾机构多尺度耦合仿生设计方法研究,批准号：51705194,申请代码：E0507,项目类别：青年科学基金项目,项目负责人： 赵佳乐,资助经费：24.0（万元）,批准年度：2017,结题年度：2020,依托单位： 吉林大学,关键词： 设计方法； 机构； 农业机械； 精密播种； 耦合仿生
187.不同经营主体行为对沿海滩涂垦区耕地质量影响及提升机制研究——以江苏省为例,批准号：41701609,申请代码：D0111,项目类别：青年科学基金项目,项目负责人： 许艳,资助经费：26.0（万元）,批准年度：2017,结题年度：2020,依托单位： 苏州科技大学,关键词： 耕地质量提升机制； 经营主体行为； 耕地资源管理； 耕地后备资源； 沿海滩涂垦区
188.非对称性增温对春箭筈豌豆种子质量形成及其子代表型可塑性的影响,批准号：31702164,申请代码：C1601,项目类别：青年科学基金项目,项目负责人： 武艳培,资助经费：23.0（万元）,批准年度：2017,结题年度：2020,依托单位： 兰州大学,关键词： 种子活力评价； 种子休眠与萌发； 牧草； 表达调控； 种子发育调控
189.基于参附注射液构建中药复方效应成分“量-效/毒”关联的质量控制新方法研究,批准号：81673592,申请代码：H3204,项目类别：面上项目,项目负责人： 杨华,资助经费：60.0（万元）,批准年度：2016,结题年度：2020,依托单位： 中国药科大学,关键词： 相互作用； 参附注射液； 质量控制方法； 效应成分； 量-效/毒关联
190.刀具前角动态调整对单晶硅超精密切削表面质量各向异性的形成和消减机制研究,批准号：51675352,申请代码：E0509,项目类别：面上项目,项目负责人： 王明海,资助经费：62.0（万元）,批准年度：2016,结题年度：2020,依托单位： 沈阳航空航天大学,关键词： 形成和消减； 表面质量各向异性； 超精密切削单晶硅； 多滑移系多尺度变形； 刀具前角动态调整
191.基于平流层大气质量环流的北半球中纬度地区冬季地面气温次季节尺度预测方法研究,批准号：41705039,申请代码：D0504,项目类别：青年科学基金项目,项目负责人： 虞越越,资助经费：25.0（万元）,批准年度：2017,结题年度：2020,依托单位： 南京信息工程大学,关键词： 平流层－对流层相互作用； 地面气温； 大气经向质量环流； 次季节尺度预测
192.中国城市吸引力的区域差异、形成机制与影响效果：基于生活质量与商业环境的双维度研究,批准号：71703059,申请代码：G0312,项目类别：青年科学基金项目,项目负责人： 刘诗濛,资助经费：17.0（万元）,批准年度：2017,结题年度：2020,依托单位： 暨南大学,关键词： 生活质量与商业环境； 区域差异； 形成机制与影响效果； 空间一般均衡模型； 城市吸引力
193.基于源导向空气质量模型的长三角地区精细化颗粒物暴露评估研究,批准号：41675125,申请代码：D0506,项目类别：面上项目,项目负责人： 胡建林,资助经费：68.0（万元）,批准年度：2016,结题年度：2020,依托单位： 南京信息工程大学,关键词： 颗粒物； 健康影响； 源导向； 空气质量模型； 暴露平评估
194.蛋白质量控制分子EBAX-1在神经发育和神经系统疾病中的作用及分子机制,批准号：31671039,申请代码：C0901,项目类别：面上项目,项目负责人： 王志萍,资助经费：67.0（万元）,批准年度：2016,结题年度：2020,依托单位： 浙江大学,关键词： EBAX-1； 秀丽隐杆线虫； 神经系统疾病； 神经发育； 蛋白质量控制
195.过渡金属二硫化物（TMDs）无相变可控插层剥离：高质量单层TMDs二维纳米材料宏量制备探索,批准号：21676198,申请代码：B0814,项目类别：面上项目,项目负责人： 范晓彬,资助经费：64.0（万元）,批准年度：2016,结题年度：2020,依托单位： 天津大学,关键词： 石墨烯； 二维纳米材料； 过渡金属二硫化物； 单层； 宏量制备
196.心肌细胞细胞质和细胞核PKA对蛋白质量的控制在心肌肥大和失代偿中的作用,批准号：31671178,申请代码：C1101,项目类别：面上项目,项目负责人： 陈雄文,资助经费：61.0（万元）,批准年度：2016,结题年度：2020,依托单位： 中国人民解放军第三军医大学,关键词： 心肌肥大； PKA； 自噬； 泛素-蛋白酶体系统； 蛋白质量控制
197.基于离散选择实验构建中国大陆人群健康效用积分体系：以SF-6D生命质量量表为例,批准号：71673197,申请代码：G0405,项目类别：面上项目,项目负责人： 吴晶,资助经费：48.0（万元）,批准年度：2016,结题年度：2020,依托单位： 天津大学,关键词： 卫生资源配置； 健康效用； 药物经济学； 卫生经济； 生命质量
198.妊娠前和妊娠期不同时段膳食碳水化合物质量对孕妇糖代谢和子代神经发育的影响及相关机制研究,批准号：81673158,申请代码：H3003,项目类别：面上项目,项目负责人： 成果,资助经费：50.0（万元）,批准年度：2016,结题年度：2020,依托单位： 四川大学,关键词： 膳食碳水化合物质量； 作用机制； 糖代谢； 神经发育； 妊娠
199.超级电容器用多孔结构NiCo2S4/rGO复合材料的可控制备及性能研究,批准号：21663029,申请代码：B0505,项目类别：地区科学基金项目,项目负责人： 孙志鹏,资助经费：40.0（万元）,批准年度：2016,结题年度：2020,依托单位： 新疆维吾尔自治区产品质量监督检验研究院,关键词： 可控制备； 复合纳米材料； 镍钴硫化合物； 超级电容器； 还原氧化石墨烯
